{
  "$schema": "https://json-schema.org/draft/2020-12/schema",
  "$id": "https://obsidian.local/schemas/obsidian-red-team.input.json",
  "title": "Obsidian Red Team — Input Contract",
  "description": "Strict input contract for the obsidian-red-team skill (ORT). Required fields are mandatory; a missing required field MUST be reported with field name, why it is critical, and how to obtain it. Version 1.0.0.",
  "type": "object",
  "additionalProperties": false,
  "required": [
    "task_id",
    "project_id",
    "request",
    "skill_version",
    "controller_version",
    "timestamp"
  ],
  "properties": {
    "task_id": {
      "type": "string",
      "minLength": 1,
      "maxLength": 128,
      "pattern": "^[A-Za-z0-9][A-Za-z0-9._:-]*$"
    },
    "project_id": {
      "type": "string",
      "minLength": 1,
      "maxLength": 128,
      "pattern": "^[A-Za-z0-9][A-Za-z0-9._:-]*$"
    },
    "request": {
      "type": "string",
      "minLength": 1,
      "maxLength": 20000,
      "description": "The natural-language audit request; must name the conclusion/artifact under attack and the intended state gate."
    },
    "skill_version": {
      "type": "string",
      "pattern": "^\\d+\\.\\d+\\.\\d+$"
    },
    "controller_version": {
      "type": "string",
      "pattern": "^[A-Za-z0-9][A-Za-z0-9._:\\-]*$"
    },
    "timestamp": {
      "type": "string",
      "pattern": "^\\d{4}-\\d{2}-\\d{2}T\\d{2}:\\d{2}:\\d{2}"
    },
    "targets": {
      "type": "array",
      "description": "The conclusions / artifacts under attack. At least one is required for a review (ORT-E102).",
      "minItems": 1,
      "maxItems": 200,
      "items": {
        "$ref": "#/$defs/target"
      }
    },
    "evidence_refs": {
      "type": "array",
      "maxItems": 500,
      "items": {
        "$ref": "#/$defs/ref"
      }
    },
    "data_refs": {
      "type": "array",
      "maxItems": 500,
      "items": {
        "$ref": "#/$defs/ref"
      }
    },
    "upstream_outputs": {
      "type": "array",
      "maxItems": 200,
      "items": {
        "$ref": "#/$defs/upstreamOutput"
      }
    },
    "samples": {
      "type": "array",
      "description": "Data rows under attack (for pseudo-replication detection). Requires data_columns.",
      "items": {
        "type": "object",
        "additionalProperties": true
      }
    },
    "data_columns": {
      "type": "array",
      "description": "Column dictionary declaring roles (id/batch/position/time/treatment/response) and sampling_unit.",
      "items": {
        "type": "object",
        "additionalProperties": true
      }
    },
    "measurements": {
      "type": "array",
      "description": "Numeric quantities under attack (value/unit/quantity) for the units/dimension scanner.",
      "items": {
        "type": "object",
        "additionalProperties": true
      }
    },
    "actions": {
      "type": "array",
      "description": "Declared/observed actions for the permission-boundary scanner.",
      "items": {
        "type": "object",
        "additionalProperties": true
      }
    },
    "escalations": {
      "type": "array",
      "description": "Claimed state upgrades for the escalation scanner.",
      "items": {
        "type": "object",
        "additionalProperties": true
      }
    },
    "flows": {
      "type": "array",
      "description": "Inflow/outflow/accumulation flows for the mass-balance flow check.",
      "items": {
        "type": "object",
        "additionalProperties": true
      }
    },
    "tolerance": {
      "type": "number",
      "exclusiveMinimum": 0,
      "maximum": 1,
      "description": "Mass-balance closure tolerance (default 0.05)."
    },
    "context": {
      "type": "object",
      "additionalProperties": true,
      "description": "Execution context: task graph, call chain, prior review outputs, environment."
    },
    "constraints": {
      "type": "object",
      "additionalProperties": true,
      "properties": {
        "state_gate": {
          "type": "string",
          "enum": ["VALIDATED", "PILOT_READY", "DEPLOYABLE", "REVIEW", ""],
          "description": "Which state upgrade this review gates. REVIEW = general review."
        },
        "max_findings": {
          "type": "integer",
          "minimum": 1,
          "maximum": 1000
        },
        "severity_filter": {
          "type": "string",
          "enum": ["INFO", "MINOR", "MAJOR", "CRITICAL", "BLOCKING"]
        },
        "focus_dimensions": {
          "type": "array",
          "items": {
            "type": "string"
          }
        },
        "require_full_ten_dimensions": {
          "type": "boolean",
          "default": true,
          "description": "When true, a dimension silently omitted from review_scope is itself a MAJOR finding."
        },
        "ammonia_limit_source": {
          "type": "string",
          "description": "Overrides the bundled ammonia/regulatory limit table; must name a jurisdiction or standard."
        }
      }
    },
    "requested_output_format": {
      "type": "string",
      "enum": ["json", "markdown+json"],
      "default": "json"
    },
    "risk_level": {
      "type": "string",
      "enum": ["low", "medium", "high", "critical"],
      "default": "low"
    },
    "human_approval_state": {
      "type": "string",
      "enum": ["not_required", "pending", "approved", "rejected"]
    },
    "actor": {
      "type": "object",
      "additionalProperties": false,
      "required": ["role"],
      "properties": {
        "role": {
          "type": "string",
          "enum": ["controller", "skill", "human", "auditor"]
        },
        "id": {
          "type": "string"
        }
      },
      "default": {
        "role": "skill"
      }
    },
    "dry_run": {
      "type": "boolean",
      "default": false
    }
  },
  "$defs": {
    "target": {
      "type": "object",
      "additionalProperties": false,
      "required": ["id", "type", "summary"],
      "properties": {
        "id": {
          "type": "string",
          "minLength": 1,
          "maxLength": 128
        },
        "type": {
          "type": "string",
          "enum": [
            "conclusion",
            "claim",
            "evidence",
            "model",
            "experiment",
            "analysis",
            "lca",
            "decision",
            "code",
            "other"
          ]
        },
        "summary": {
          "type": "string",
          "minLength": 1,
          "maxLength": 6000
        },
        "location": {
          "type": "string",
          "maxLength": 2000,
          "description": "File / field / figure / conclusion location of the claim."
        },
        "epistemic_label": {
          "type": "string",
          "enum": [
            "OBSERVED",
            "REPORTED",
            "CALCULATED",
            "INFERRED",
            "HYPOTHESIS",
            "RECOMMENDATION"
          ],
          "description": "The epistemic label the author attached to this claim. A stronger-than-supported label is a finding."
        },
        "status_support": {
          "type": "string",
          "enum": [
            "SUPPORTED",
            "VALIDATED",
            "PILOT_READY",
            "DEPLOYABLE",
            "OPEN",
            ""
          ],
          "description": "The state upgrade the author claims this target supports. Used by the escalation checker."
        },
        "author_claimed": {
          "type": "string",
          "maxLength": 6000,
          "description": "Quoted or summarized original wording (attacked verbatim, not straw-manned)."
        },
        "ammonia_concentration": {
          "type": "number",
          "minimum": 0,
          "description": "Reported ammonia (NH4+/NH3-N) concentration in mg/L, used by the environment/safety scan."
        },
        "recommends_deployment": {
          "type": "boolean",
          "description": "Whether the author recommends field deployment for this target."
        },
        "open_blockers": {
          "type": "integer",
          "minimum": 0,
          "description": "Number of BLOCKING findings still open from a prior review."
        },
        "cites": {
          "type": "array",
          "items": {
            "type": "string"
          },
          "description": "ref_ids this target cites, used by the provenance chain checker."
        },
        "claims": {
          "type": "array",
          "items": {
            "type": "string"
          },
          "description": "Raw claim sentences, used by the MICP trap scanner."
        },
        "alternatives": {
          "type": "array",
          "items": {
            "type": "object",
            "additionalProperties": false,
            "required": ["explanation"],
            "properties": {
              "explanation": {
                "type": "string",
                "minLength": 1
              },
              "fits_evidence": {
                "type": "boolean"
              }
            }
          }
        },
        "analysis": {
          "type": "object",
          "description": "Statistical claim structure for the stats scanner."
        },
        "model": {
          "type": "object",
          "description": "Model specification for the model-boundary scanner."
        },
        "measurements": {
          "type": "array",
          "items": {
            "type": "object",
            "additionalProperties": true
          }
        }
      }
    },
    "ref": {
      "type": "object",
      "additionalProperties": false,
      "required": ["ref_id", "locator"],
      "properties": {
        "ref_id": {
          "type": "string",
          "minLength": 1,
          "maxLength": 128
        },
        "locator": {
          "type": "string",
          "minLength": 1,
          "maxLength": 2000,
          "description": "Resolvable locator: doi:xxx, https://doi.org/..., http(s) URL, or a project file ref."
        },
        "title": {
          "type": "string",
          "maxLength": 2000
        },
        "authors": {
          "type": "string",
          "maxLength": 2000
        },
        "year": {
          "type": "integer",
          "minimum": 1800,
          "maximum": 2100
        },
        "journal": {
          "type": "string",
          "maxLength": 500
        },
        "verdict": {
          "type": "string",
          "enum": ["VERIFIED", "SUSPECTED", "REJECTED", "UNVERIFIED"],
          "description": "A prior verification verdict for this reference."
        },
        "media_type": {
          "type": "string",
          "maxLength": 128
        },
        "note": {
          "type": "string",
          "maxLength": 2000
        }
      }
    },
    "upstreamOutput": {
      "type": "object",
      "additionalProperties": false,
      "required": ["skill", "task_node"],
      "properties": {
        "skill": {
          "type": "string",
          "minLength": 1,
          "maxLength": 128
        },
        "task_node": {
          "type": "string",
          "minLength": 1,
          "maxLength": 128
        },
        "summary": {
          "type": "string",
          "maxLength": 4000
        },
        "output": {
          "type": "object"
        }
      }
    }
  }
}
