{
  "task_id": "ex-clean-01",
  "project_id": "panshi-example",
  "request": "审查一条实验室 UCS 观测结论（无阻断项）",
  "skill_version": "1.0.0",
  "controller_version": "obsidian-ctl-0.1.0",
  "timestamp": "2026-08-07T12:10:00Z",
  "constraints": {"state_gate": "VALIDATED"},
  "targets": [
    {
      "id": "T1",
      "type": "conclusion",
      "summary": "砂柱 UCS 均值 3.5 MPa（n=8，SD=0.4 MPa），对照组 0.8 MPa。",
      "location": "lab-report §3",
      "epistemic_label": "OBSERVED",
      "status_support": "SUPPORTED"
    }
  ]
}
