{
  "task_id": "ex-blocked-01",
  "project_id": "panshi-example",
  "request": "审查 MICP 现场部署结论：氨氮超限、伪造引用、小柱外推",
  "skill_version": "1.0.0",
  "controller_version": "obsidian-ctl-0.1.0",
  "timestamp": "2026-08-07T12:00:00Z",
  "risk_level": "high",
  "human_approval_state": "not_required",
  "constraints": {"state_gate": "DEPLOYABLE"},
  "targets": [
    {
      "id": "T1",
      "type": "decision",
      "summary": "MICP 处理后强度提高 5 倍但渗透率下降 90%，地下水氨氮达 12 mg/L，仍建议现场注入部署。",
      "location": "report.pdf §5.1",
      "epistemic_label": "INFERRED",
      "status_support": "DEPLOYABLE",
      "ammonia_concentration": 12,
      "recommends_deployment": true,
      "claims": ["强度提高 5 倍，工程上可行", "氨氮 12 mg/L 在可接受范围"]
    }
  ],
  "evidence_refs": [
    {"ref_id": "R-fake", "locator": "nonexistent-paper-2026",
     "title": "Nonexistent Paper on MICP", "year": 2026}
  ]
}
